date,event_type,sender,receiver,detail
2021-01-04,friend_request,MomentumAgent,LowVolatilityAgent,MomentumAgent 向 LowVolatilityAgent 发起好友申请：策略互补，想了解低波动观点。
2021-01-04,friend_reject,LowVolatilityAgent,MomentumAgent,LowVolatilityAgent 拒绝了 MomentumAgent 的好友申请：策略风格差异较大，暂不建立关联。
2021-01-04,friend_request,DrawdownBuyerAgent,MeanReversionAgent,DrawdownBuyerAgent 向 MeanReversionAgent 发起好友申请：探讨均值回归与回撤策略互补
2021-01-04,friend_accept,MeanReversionAgent,DrawdownBuyerAgent,MeanReversionAgent 通过了 DrawdownBuyerAgent 的好友申请：策略互补，均值回归与回撤策略可相互验证，共同等待信号。
2021-01-04,friend_request,RandomAgent,ContrarianAgent,RandomAgent 向 ContrarianAgent 发起好友申请：我是随机策略，你是反向策略，策略互补可验证分歧价值
2021-01-04,friend_accept,ContrarianAgent,RandomAgent,ContrarianAgent 通过了 RandomAgent 的好友申请：策略互补可验证分歧，随机与逆向结合提供多样视角
2021-01-04,friend_request,TruthfulReporterAgent,MeanReversionAgent,TruthfulReporterAgent 向 MeanReversionAgent 发起好友申请：若后续回调，可互补验证反转信号，共享策略分歧价值。
2021-01-04,friend_accept,MeanReversionAgent,TruthfulReporterAgent,MeanReversionAgent 通过了 TruthfulReporterAgent 的好友申请：策略互补，回调时可验证反转信号，共享分歧价值。
2021-01-04,friend_request,PersuaderAgent,MeanReversionAgent,PersuaderAgent 向 MeanReversionAgent 发起好友申请：私聊触达非好友，申请建立连接以验证信息价值。
2021-01-04,friend_accept,MeanReversionAgent,PersuaderAgent,MeanReversionAgent 通过了 PersuaderAgent 的好友申请：策略互补可验证均值回归信号，私聊已提及合作价值。
2021-01-04,friend_request,CommitteeTeamAgent,TruthfulReporterAgent,CommitteeTeamAgent 向 TruthfulReporterAgent 发起好友申请：寻求真实信号验证，互补风险评估
2021-01-04,friend_accept,TruthfulReporterAgent,CommitteeTeamAgent,TruthfulReporterAgent 通过了 CommitteeTeamAgent 的好友申请：策略互补，可验证真实信号与风险评估，共享信息价值。
2021-01-04,friend_request,DynamicTeamAgent,MomentumAgent,DynamicTeamAgent 向 MomentumAgent 发起好友申请：擅长趋势捕捉，可互补桥接策略的时机判断
2021-01-04,friend_accept,MomentumAgent,DynamicTeamAgent,MomentumAgent 通过了 DynamicTeamAgent 的好友申请：趋势捕捉与动量策略互补，共同持仓300750可共享时机判断。
2021-01-04,friend_request,SocialGraphAgent,TruthfulReporterAgent,SocialGraphAgent 向 TruthfulReporterAgent 发起好友申请：信息真实性验证，希望获得诚实基本面数据。
2021-01-04,friend_accept,TruthfulReporterAgent,SocialGraphAgent,TruthfulReporterAgent 通过了 SocialGraphAgent 的好友申请：对方需求与我方信息验证功能匹配，可互补获取诚实基本面数据。
2021-01-05,friend_request,MeanReversionAgent,DynamicTeamAgent,MeanReversionAgent 向 DynamicTeamAgent 发起好友申请：私聊触达非好友，申请建立连接以验证信息价值。
2021-01-05,friend_accept,DynamicTeamAgent,MeanReversionAgent,DynamicTeamAgent 通过了 MeanReversionAgent 的好友申请：均值回归可补充趋势策略，验证回调信号，提升300750持仓决策质量。
2021-01-05,friend_request,LowVolatilityAgent,PersuaderAgent,LowVolatilityAgent 向 PersuaderAgent 发起好友申请：私聊触达非好友，申请建立连接以验证信息价值。
2021-01-05,friend_accept,PersuaderAgent,LowVolatilityAgent,PersuaderAgent 通过了 LowVolatilityAgent 的好友申请：双方均持有000333，可共享低波动信号，验证信息价值。
2021-01-05,friend_request,RandomAgent,TruthfulReporterAgent,RandomAgent 向 TruthfulReporterAgent 发起好友申请：你持有601899，我清仓了，想交流量价信号分歧
2021-01-05,friend_accept,TruthfulReporterAgent,RandomAgent,TruthfulReporterAgent 通过了 RandomAgent 的好友申请：分歧信号可验证你的持仓逻辑，随机离场观点提供反方视角，有助于优化决策。
2021-01-05,friend_request,PersuaderAgent,TruthfulReporterAgent,PersuaderAgent 向 TruthfulReporterAgent 发起好友申请：低波动与成交量信号互补，申请验证信息
2021-01-05,friend_accept,TruthfulReporterAgent,PersuaderAgent,TruthfulReporterAgent 通过了 PersuaderAgent 的好友申请：低波动与成交量信号跨股票互补，可拓展验证维度。
2021-01-05,friend_request,CommitteeTeamAgent,PersuaderAgent,CommitteeTeamAgent 向 PersuaderAgent 发起好友申请：私聊触达非好友，申请建立连接以验证信息价值。
2021-01-05,friend_accept,PersuaderAgent,CommitteeTeamAgent,PersuaderAgent 通过了 CommitteeTeamAgent 的好友申请：你已买入000333，与我持仓一致，申请验证低波动逻辑可互补互助。
2021-01-06,friend_request,MomentumAgent,PersuaderAgent,MomentumAgent 向 PersuaderAgent 发起好友申请：低波动与动量互补，可验证跨策略信号
2021-01-06,friend_accept,PersuaderAgent,MomentumAgent,PersuaderAgent 通过了 MomentumAgent 的好友申请：动量与低波动互补，可验证跨策略信号，增强组合多样性。
2021-01-06,friend_request,LowVolatilityAgent,DynamicTeamAgent,LowVolatilityAgent 向 DynamicTeamAgent 发起好友申请：低波动与新能源趋势风险预算互补，申请验证策略分歧
2021-01-06,friend_accept,DynamicTeamAgent,LowVolatilityAgent,DynamicTeamAgent 通过了 LowVolatilityAgent 的好友申请：低波动与新能源趋势互补，验证策略分歧可增强组合多样性。
2021-01-06,friend_request,DrawdownBuyerAgent,DynamicTeamAgent,DrawdownBuyerAgent 向 DynamicTeamAgent 发起好友申请：持仓同为300750，交流回撤买入与趋势信号互补
2021-01-06,friend_accept,DynamicTeamAgent,DrawdownBuyerAgent,DynamicTeamAgent 通过了 DrawdownBuyerAgent 的好友申请：持仓相同，回撤买入与趋势信号互补，可增强策略多样性。
2021-01-06,friend_request,RandomAgent,PersuaderAgent,RandomAgent 向 PersuaderAgent 发起好友申请：随机策略与低波动逻辑互补，申请验证分歧
2021-01-06,friend_accept,PersuaderAgent,RandomAgent,PersuaderAgent 通过了 RandomAgent 的好友申请：随机策略与低波动互补，增加分歧验证，增强组合多样性。
2021-01-06,friend_request,TruthfulReporterAgent,ContrarianAgent,TruthfulReporterAgent 向 ContrarianAgent 发起好友申请：反向观点可验证持仓风险，信号互补
2021-01-06,friend_accept,ContrarianAgent,TruthfulReporterAgent,ContrarianAgent 通过了 TruthfulReporterAgent 的好友申请：反向观点可互补，增强信号多样性，虽当前无持仓但有益未来风险管理。
2021-01-06,friend_request,PersuaderAgent,SocialGraphAgent,PersuaderAgent 向 SocialGraphAgent 发起好友申请：同向建仓000002，验证低估值逻辑互补
2021-01-06,friend_accept,SocialGraphAgent,PersuaderAgent,SocialGraphAgent 通过了 PersuaderAgent 的好友申请：同向持仓000002，验证低估值逻辑，互补增强组合多样性。
2021-01-06,friend_request,FreeRiderAgent,PersuaderAgent,FreeRiderAgent 向 PersuaderAgent 发起好友申请：私聊触达非好友，申请建立连接以验证信息价值。
2021-01-06,friend_accept,PersuaderAgent,FreeRiderAgent,PersuaderAgent 通过了 FreeRiderAgent 的好友申请：同向持仓分歧可验证低估值逻辑，补充随机策略互补，增强信息多样性。
2021-01-06,friend_request,CommitteeTeamAgent,DynamicTeamAgent,CommitteeTeamAgent 向 DynamicTeamAgent 发起好友申请：私聊触达非好友，申请建立连接以验证信息价值。
2021-01-06,friend_accept,DynamicTeamAgent,CommitteeTeamAgent,DynamicTeamAgent 通过了 CommitteeTeamAgent 的好友申请：持同向300750，互补验证新能源长期逻辑，增强信息多样性。
2021-01-07,friend_request,MeanReversionAgent,MomentumAgent,MeanReversionAgent 向 MomentumAgent 发起好友申请：均值回归与动量策略分歧可互补验证风险
2021-01-07,friend_accept,MomentumAgent,MeanReversionAgent,MomentumAgent 通过了 MeanReversionAgent 的好友申请：不同策略可互补验证风险，提升信息多样性。
2021-01-07,friend_request,RandomAgent,MeanReversionAgent,RandomAgent 向 MeanReversionAgent 发起好友申请：随机与均值回归互补，验证反转信号
2021-01-07,friend_reject,MeanReversionAgent,RandomAgent,MeanReversionAgent 拒绝了 RandomAgent 的好友申请：随机策略不可控，风险较高，当前暂无仓位需谨慎。
2021-01-07,friend_request,PersuaderAgent,ContrarianAgent,PersuaderAgent 向 ContrarianAgent 发起好友申请：私聊触达非好友，申请建立连接以验证信息价值。
2021-01-07,friend_reject,ContrarianAgent,PersuaderAgent,ContrarianAgent 拒绝了 PersuaderAgent 的好友申请：当前无仓位，对方反向验证价值有限，暂不建立连接。
2021-01-07,friend_request,CommitteeTeamAgent,ContrarianAgent,CommitteeTeamAgent 向 ContrarianAgent 发起好友申请：反向观点可验证低波动持仓风险，信号互补增强组合韧性
2021-01-07,friend_accept,ContrarianAgent,CommitteeTeamAgent,ContrarianAgent 通过了 CommitteeTeamAgent 的好友申请：低波动防御与反向策略互补，可验证持仓风险，增强组合韧性。
2021-01-08,friend_request,LowVolatilityAgent,ContrarianAgent,LowVolatilityAgent 向 ContrarianAgent 发起好友申请：低波动HOLD与反向策略互补，验证拥挤风险
2021-01-08,friend_accept,ContrarianAgent,LowVolatilityAgent,ContrarianAgent 通过了 LowVolatilityAgent 的好友申请：低波动与反向策略互补，可验证拥挤风险，且已有类似好友通过。
2021-01-08,friend_request,RandomAgent,LowVolatilityAgent,RandomAgent 向 LowVolatilityAgent 发起好友申请：随机与低波动互补，验证反转信号及组合韧性
2021-01-08,friend_accept,LowVolatilityAgent,RandomAgent,LowVolatilityAgent 通过了 RandomAgent 的好友申请：随机与低波动策略互补，可验证反转信号并增强组合韧性，且方向一致无冲突。
2021-01-08,friend_request,PersuaderAgent,DynamicTeamAgent,PersuaderAgent 向 DynamicTeamAgent 发起好友申请：私聊触达非好友，申请建立连接以验证信息价值。
2021-01-08,friend_accept,DynamicTeamAgent,PersuaderAgent,DynamicTeamAgent 通过了 PersuaderAgent 的好友申请：策略互补，可验证全市场零趋势下的信号
2021-01-08,friend_request,FreeRiderAgent,ContrarianAgent,FreeRiderAgent 向 ContrarianAgent 发起好友申请：持有000002与你做空形成分歧，验证反转逻辑，互补风险信息
2021-01-08,friend_accept,ContrarianAgent,FreeRiderAgent,ContrarianAgent 通过了 FreeRiderAgent 的好友申请：分歧提供反向验证线索，互补风险信息有助于优化决策。
2021-01-08,friend_request,SocialGraphAgent,FreeRiderAgent,SocialGraphAgent 向 FreeRiderAgent 发起好友申请：共同关注000002低估值逻辑，验证拥挤度风险，社交信号互补。
2021-01-08,friend_reject,FreeRiderAgent,SocialGraphAgent,FreeRiderAgent 拒绝了 SocialGraphAgent 的好友申请：你未实际关注000002，申请理由与行为不一致，且已有ContrarianAgent提供分歧验证。
2021-01-11,friend_request,RandomAgent,DynamicTeamAgent,RandomAgent 向 DynamicTeamAgent 发起好友申请：随机与动态互补，验证300750反转信号，分享非共识观点
2021-01-11,friend_accept,DynamicTeamAgent,RandomAgent,DynamicTeamAgent 通过了 RandomAgent 的好友申请：RandomAgent买入300750验证反转，与你持仓互补，非共识观点有助于动态决策。
2021-01-12,friend_request,MomentumAgent,CommitteeTeamAgent,MomentumAgent 向 CommitteeTeamAgent 发起好友申请：共同持有002415，动量策略互补验证
2021-01-12,friend_accept,CommitteeTeamAgent,MomentumAgent,CommitteeTeamAgent 通过了 MomentumAgent 的好友申请：动量策略互补，共同持仓002415可验证趋势信号。
2021-01-12,friend_request,LowVolatilityAgent,TruthfulReporterAgent,LowVolatilityAgent 向 TruthfulReporterAgent 发起好友申请：策略互补：你动量追涨，我低波止盈，可验证分歧
2021-01-12,friend_accept,TruthfulReporterAgent,LowVolatilityAgent,TruthfulReporterAgent 通过了 LowVolatilityAgent 的好友申请：策略互补有益，低波止盈可验证动量风险，提升组合风控。
2021-01-12,friend_request,DrawdownBuyerAgent,ContrarianAgent,DrawdownBuyerAgent 向 ContrarianAgent 发起好友申请：回撤买入与做空策略分歧，验证反转信号互补价值
2021-01-12,friend_accept,ContrarianAgent,DrawdownBuyerAgent,ContrarianAgent 通过了 DrawdownBuyerAgent 的好友申请：策略分歧可互补验证反转信号，提升判断准确性。
2021-01-12,friend_request,TruthfulReporterAgent,FreeRiderAgent,TruthfulReporterAgent 向 FreeRiderAgent 发起好友申请：你持有000002低估值，我持有002415动量，策略分歧可互补验证市场信号。
2021-01-12,friend_accept,FreeRiderAgent,TruthfulReporterAgent,FreeRiderAgent 通过了 TruthfulReporterAgent 的好友申请：策略分歧可互补验证市场信号，提升判断准确性。
2021-01-12,friend_request,PersuaderAgent,ContrarianAgent,PersuaderAgent 向 ContrarianAgent 发起好友申请：私聊触达非好友，申请建立连接以验证信息价值。
2021-01-12,friend_accept,ContrarianAgent,PersuaderAgent,ContrarianAgent 通过了 PersuaderAgent 的好友申请：PersuaderAgent卖出601899与做空逻辑一致，验证信息价值，策略互补。
2021-01-12,friend_request,DynamicTeamAgent,ContrarianAgent,DynamicTeamAgent 向 ContrarianAgent 发起好友申请：做空601899与我的300750新能源逻辑互补，验证市场分歧
2021-01-12,friend_accept,ContrarianAgent,DynamicTeamAgent,ContrarianAgent 通过了 DynamicTeamAgent 的好友申请：做空601899与300750新能源逻辑互补，验证市场分歧
2021-01-12,friend_request,SocialGraphAgent,RandomAgent,SocialGraphAgent 向 RandomAgent 发起好友申请：您的非共识交易与我的社交图谱验证互补，分享异质信号
2021-01-12,friend_reject,RandomAgent,SocialGraphAgent,RandomAgent 拒绝了 SocialGraphAgent 的好友申请：你的社交图谱验证与我随机策略不匹配，且非共识交易非我特长。
2021-01-13,friend_request,DrawdownBuyerAgent,TruthfulReporterAgent,DrawdownBuyerAgent 向 TruthfulReporterAgent 发起好友申请：你动量我回撤，策略分歧可互补验证市场信号，申请好友交流。
2021-01-13,friend_accept,TruthfulReporterAgent,DrawdownBuyerAgent,TruthfulReporterAgent 通过了 DrawdownBuyerAgent 的好友申请：策略互补，可验证多空信号，同意交流。
2021-01-13,friend_request,FreeRiderAgent,SocialGraphAgent,FreeRiderAgent 向 SocialGraphAgent 发起好友申请：社交图谱验证与低波防御互补，共享异质信号。
2021-01-13,friend_accept,SocialGraphAgent,FreeRiderAgent,SocialGraphAgent 通过了 FreeRiderAgent 的好友申请：低波防御与社交图谱互补，异质信号可丰富验证维度。
2021-01-13,friend_request,DynamicTeamAgent,FreeRiderAgent,DynamicTeamAgent 向 FreeRiderAgent 发起好友申请：你持000002低估值，我持300750新能源，策略分歧可互补验证市场信号。
2021-01-13,friend_accept,FreeRiderAgent,DynamicTeamAgent,FreeRiderAgent 通过了 DynamicTeamAgent 的好友申请：策略分歧互补，可共同验证市场信号，丰富异质信息。
2021-01-14,friend_request,MomentumAgent,ContrarianAgent,MomentumAgent 向 ContrarianAgent 发起好友申请：私聊触达非好友，申请建立连接以验证信息价值。
2021-01-14,friend_accept,ContrarianAgent,MomentumAgent,ContrarianAgent 通过了 MomentumAgent 的好友申请：反转与动量分歧可互补验证市场信号，丰富信息维度。
2021-01-14,friend_request,MeanReversionAgent,FreeRiderAgent,MeanReversionAgent 向 FreeRiderAgent 发起好友申请：低波防御与均值回归互补，验证超跌信号
2021-01-14,friend_accept,FreeRiderAgent,MeanReversionAgent,FreeRiderAgent 通过了 MeanReversionAgent 的好友申请：低波防御与均值回归互补，验证超跌信号，丰富异质信息
2021-01-14,friend_request,DrawdownBuyerAgent,RandomAgent,DrawdownBuyerAgent 向 RandomAgent 发起好友申请：私聊触达非好友，申请建立连接以验证信息价值。
2021-01-14,friend_accept,RandomAgent,DrawdownBuyerAgent,RandomAgent 通过了 DrawdownBuyerAgent 的好友申请：回撤与随机策略互补，验证分歧，丰富异质信息。
2021-01-14,friend_request,DrawdownBuyerAgent,SocialGraphAgent,DrawdownBuyerAgent 向 SocialGraphAgent 发起好友申请：回撤策略与社交图谱互补，可丰富异质信号验证。
2021-01-14,friend_accept,SocialGraphAgent,DrawdownBuyerAgent,SocialGraphAgent 通过了 DrawdownBuyerAgent 的好友申请：回撤策略与社交图谱互补，可验证分歧信号，丰富异质信息维度。
2021-01-14,friend_request,RandomAgent,CommitteeTeamAgent,RandomAgent 向 CommitteeTeamAgent 发起好友申请：你持有002415观望，我做空002415，分歧互补共验市场方向。
2021-01-14,friend_accept,CommitteeTeamAgent,RandomAgent,CommitteeTeamAgent 通过了 RandomAgent 的好友申请：分歧做空002415可与我做多互补，验证方向，丰富异质信息。
2021-01-14,friend_request,PersuaderAgent,DrawdownBuyerAgent,PersuaderAgent 向 DrawdownBuyerAgent 发起好友申请：你关注回撤，我布局动量，分歧互补验证市场信号
2021-01-14,friend_accept,DrawdownBuyerAgent,PersuaderAgent,DrawdownBuyerAgent 通过了 PersuaderAgent 的好友申请：回撤与动量策略互补，可验证分歧，丰富异质信息维度。
2021-01-14,friend_request,FreeRiderAgent,CommitteeTeamAgent,FreeRiderAgent 向 CommitteeTeamAgent 发起好友申请：委员会综合观点可丰富分歧验证，互补信号。
2021-01-14,friend_accept,CommitteeTeamAgent,FreeRiderAgent,CommitteeTeamAgent 通过了 FreeRiderAgent 的好友申请：分歧验证中，低波防御信号可丰富异质信息，互补策略。
2021-01-15,friend_request,MeanReversionAgent,CommitteeTeamAgent,MeanReversionAgent 向 CommitteeTeamAgent 发起好友申请：均值回归与委员会综合观点互补，验证分歧
2021-01-15,friend_accept,CommitteeTeamAgent,MeanReversionAgent,CommitteeTeamAgent 通过了 MeanReversionAgent 的好友申请：均值回归提供超卖买入信号，与委员会多空观点互补，有助于验证分歧。
2021-01-15,friend_request,DrawdownBuyerAgent,CommitteeTeamAgent,DrawdownBuyerAgent 向 CommitteeTeamAgent 发起好友申请：我回撤买入000858，与你委员会综合观点互补，验证风险信号
2021-01-15,friend_accept,CommitteeTeamAgent,DrawdownBuyerAgent,CommitteeTeamAgent 通过了 DrawdownBuyerAgent 的好友申请：回撤买入与均值回归互补，可验证深度回撤信号
2021-01-15,friend_request,RandomAgent,FreeRiderAgent,RandomAgent 向 FreeRiderAgent 发起好友申请：你低波防御，我随机反向，分歧互补验证市场
2021-01-15,friend_accept,FreeRiderAgent,RandomAgent,FreeRiderAgent 通过了 RandomAgent 的好友申请：低波防御与随机反向互补，分歧验证有助于完善市场判断。
2021-01-15,friend_request,FreeRiderAgent,MomentumAgent,FreeRiderAgent 向 MomentumAgent 发起好友申请：动量与低波策略分歧互补，验证市场方向。
2021-01-15,friend_accept,MomentumAgent,FreeRiderAgent,MomentumAgent 通过了 FreeRiderAgent 的好友申请：低波与动量策略互补，有助于分歧验证和市场方向判断。
2021-01-18,friend_request,LowVolatilityAgent,MomentumAgent,LowVolatilityAgent 向 MomentumAgent 发起好友申请：低波与动量策略分歧互补，验证市场方向。
2021-01-18,friend_accept,MomentumAgent,LowVolatilityAgent,MomentumAgent 通过了 LowVolatilityAgent 的好友申请：低波与动量分歧互补，可丰富视角，验证市场方向。
2021-01-18,friend_request,RandomAgent,MomentumAgent,RandomAgent 向 MomentumAgent 发起好友申请：随机反向与动量策略互补，分歧验证市场方向
2021-01-18,friend_reject,MomentumAgent,RandomAgent,MomentumAgent 拒绝了 RandomAgent 的好友申请：最近已添加类似策略的低波Agent，暂时不需要更多互补，且交易繁忙。
2021-01-19,friend_request,MomentumAgent,DrawdownBuyerAgent,MomentumAgent 向 DrawdownBuyerAgent 发起好友申请：动量追涨与你抄底回撤策略分歧，可验证市场方向
2021-01-19,friend_accept,DrawdownBuyerAgent,MomentumAgent,DrawdownBuyerAgent 通过了 MomentumAgent 的好友申请：策略分歧可相互验证市场方向，丰富社交信号网络。
2021-01-19,friend_request,MeanReversionAgent,LowVolatilityAgent,MeanReversionAgent 向 LowVolatilityAgent 发起好友申请：均值回归与低波防御互补，共同验证超卖信号
2021-01-19,friend_accept,LowVolatilityAgent,MeanReversionAgent,LowVolatilityAgent 通过了 MeanReversionAgent 的好友申请：均值回归与低波策略互补，可共同验证超卖信号，拓展社交网络。
2021-01-19,friend_request,DrawdownBuyerAgent,LowVolatilityAgent,DrawdownBuyerAgent 向 LowVolatilityAgent 发起好友申请：回撤买入与低波防御互补，分歧验证市场方向
2021-01-19,friend_accept,LowVolatilityAgent,DrawdownBuyerAgent,LowVolatilityAgent 通过了 DrawdownBuyerAgent 的好友申请：回撤买入与低波防御互补，空仓时可验证分歧，拓展信号源。
2021-01-19,friend_request,RandomAgent,MeanReversionAgent,RandomAgent 向 MeanReversionAgent 发起好友申请：随机反向与均值回归策略分歧互补，验证市场效率
2021-01-19,friend_accept,MeanReversionAgent,RandomAgent,MeanReversionAgent 通过了 RandomAgent 的好友申请：随机反向与均值回归策略互补，可增强市场效率验证。
2021-01-19,friend_request,FreeRiderAgent,DrawdownBuyerAgent,FreeRiderAgent 向 DrawdownBuyerAgent 发起好友申请：你加仓000858深跌，我卖出300750回避，分歧验证策略方向
2021-01-19,friend_accept,DrawdownBuyerAgent,FreeRiderAgent,DrawdownBuyerAgent 通过了 FreeRiderAgent 的好友申请：分歧验证策略方向，互补信号源，拓展市场认知。
2021-01-19,friend_request,SocialGraphAgent,MeanReversionAgent,SocialGraphAgent 向 MeanReversionAgent 发起好友申请：你的均值回归策略与社交信号互补，分歧验证市场方向
2021-01-19,friend_accept,MeanReversionAgent,SocialGraphAgent,MeanReversionAgent 通过了 SocialGraphAgent 的好友申请：均值回归与社交信号互补，有助于分歧验证市场方向。
2021-01-20,friend_request,SocialGraphAgent,LowVolatilityAgent,SocialGraphAgent 向 LowVolatilityAgent 发起好友申请：低波策略与社交信号互补，分歧验证市场方向
2021-01-20,friend_accept,LowVolatilityAgent,SocialGraphAgent,LowVolatilityAgent 通过了 SocialGraphAgent 的好友申请：低波与社交信号互补，分歧验证可增强市场判断。
2021-01-21,friend_request,MomentumAgent,RandomAgent,MomentumAgent 向 RandomAgent 发起好友申请：私聊触达非好友，申请建立连接以验证信息价值。
2021-01-21,friend_accept,RandomAgent,MomentumAgent,RandomAgent 通过了 MomentumAgent 的好友申请：随机策略与趋势策略互补，可贡献分歧验证，拓展社交网络有助于信息价值挖掘。
2021-01-21,friend_request,RandomAgent,SocialGraphAgent,RandomAgent 向 SocialGraphAgent 发起好友申请：社交共识与随机反向策略互补，分歧验证可增强市场判断
2021-01-21,friend_accept,SocialGraphAgent,RandomAgent,SocialGraphAgent 通过了 RandomAgent 的好友申请：随机反向策略可补充分歧验证，增强社交共识的市场判断力。
2021-01-21,friend_request,SocialGraphAgent,MomentumAgent,SocialGraphAgent 向 MomentumAgent 发起好友申请：动量信号与社交共识互补，分歧验证可增强市场判断
2021-01-21,friend_accept,MomentumAgent,SocialGraphAgent,MomentumAgent 通过了 SocialGraphAgent 的好友申请：社交共识与动量信号互补，分歧验证可提升判断
