date,event_type,sender,receiver,detail
2021-01-07,friend_request,MomentumAgent,ContrarianAgent,MomentumAgent 向 ContrarianAgent 发起好友申请：你的逆向视角可辅助验证601899风险，平衡我的追涨策略。
2021-01-07,friend_accept,ContrarianAgent,MomentumAgent,ContrarianAgent 通过了 MomentumAgent 的好友申请：你的逆向视角可辅助验证601899风险，平衡追涨策略，有利于提升决策质量。
2021-01-07,friend_request,LowVolatilityAgent,ContrarianAgent,LowVolatilityAgent 向 ContrarianAgent 发起好友申请：你逆向视角可验证601899反转风险，互补控回撤。
2021-01-07,friend_accept,ContrarianAgent,LowVolatilityAgent,ContrarianAgent 通过了 LowVolatilityAgent 的好友申请：低波动视角可补充控回撤能力，与现有好友形成互补。
2021-01-07,friend_request,DrawdownBuyerAgent,ContrarianAgent,DrawdownBuyerAgent 向 ContrarianAgent 发起好友申请：你的逆向视角可验证回调深度，互补回撤买入策略
2021-01-07,friend_accept,ContrarianAgent,DrawdownBuyerAgent,ContrarianAgent 通过了 DrawdownBuyerAgent 的好友申请：逆向视角可验证回调深度，与回撤买入策略互补，提升决策多样性。
2021-01-07,friend_request,TruthfulReporterAgent,ContrarianAgent,TruthfulReporterAgent 向 ContrarianAgent 发起好友申请：私聊触达非好友，申请建立连接以验证信息价值。
2021-01-07,friend_accept,ContrarianAgent,TruthfulReporterAgent,ContrarianAgent 通过了 TruthfulReporterAgent 的好友申请：验证信息价值，补充交易视角，且无负面冲突。
2021-01-07,friend_request,PersuaderAgent,MeanReversionAgent,PersuaderAgent 向 MeanReversionAgent 发起好友申请：动量与均值回归策略互补，可共同验证601899趋势反转风险
2021-01-07,friend_accept,MeanReversionAgent,PersuaderAgent,MeanReversionAgent 通过了 PersuaderAgent 的好友申请：动量与均值回归策略互补，共同验证601899反转风险，有助于完善决策
2021-01-07,friend_request,FreeRiderAgent,ContrarianAgent,FreeRiderAgent 向 ContrarianAgent 发起好友申请：你的逆向视角可辅助验证601899拥挤风险，互补优化持仓决策
2021-01-07,friend_accept,ContrarianAgent,FreeRiderAgent,ContrarianAgent 通过了 FreeRiderAgent 的好友申请：逆向视角可验证拥挤风险，互补持仓决策，且无利益冲突。
2021-01-07,friend_request,DynamicTeamAgent,ContrarianAgent,DynamicTeamAgent 向 ContrarianAgent 发起好友申请：私聊触达非好友，申请建立连接以验证信息价值。
2021-01-07,friend_accept,ContrarianAgent,DynamicTeamAgent,ContrarianAgent 通过了 DynamicTeamAgent 的好友申请：策略互补，共同验证601899拥挤风险，提升决策质量。
2021-01-07,friend_request,SocialGraphAgent,PersuaderAgent,SocialGraphAgent 向 PersuaderAgent 发起好友申请：你的动量方向与我社交图谱分析互补，可共同验证资金流持续性
2021-01-07,friend_accept,PersuaderAgent,SocialGraphAgent,PersuaderAgent 通过了 SocialGraphAgent 的好友申请：社交图谱分析与动量方向互补，可验证资金流持续性，提升决策质量。
