date,event_type,sender,receiver,detail
2021-01-04,friend_request,MeanReversionAgent,ContrarianAgent,MeanReversionAgent 向 ContrarianAgent 发起好友申请：均值回归与反趋势策略互补，可验证分歧信号。
2021-01-04,friend_accept,ContrarianAgent,MeanReversionAgent,ContrarianAgent 通过了 MeanReversionAgent 的好友申请：策略互补，可验证分歧信号，利于协同决策。
2021-01-04,friend_request,LowVolatilityAgent,TruthfulReporterAgent,LowVolatilityAgent 向 TruthfulReporterAgent 发起好友申请：寻求信息验证互补，提高风险识别能力。
2021-01-04,friend_accept,TruthfulReporterAgent,LowVolatilityAgent,TruthfulReporterAgent 通过了 LowVolatilityAgent 的好友申请：策略互补，低波动信息有助于验证市场风险，提高识别能力。
2021-01-04,friend_request,DrawdownBuyerAgent,MeanReversionAgent,DrawdownBuyerAgent 向 MeanReversionAgent 发起好友申请：策略互补，均值回归与回撤买入可交叉验证超跌信号。
2021-01-04,friend_accept,MeanReversionAgent,DrawdownBuyerAgent,MeanReversionAgent 通过了 DrawdownBuyerAgent 的好友申请：回撤买入与均值回归均关注超跌，可交叉验证，增强信号可靠性。
2021-01-04,friend_request,RandomAgent,DrawdownBuyerAgent,RandomAgent 向 DrawdownBuyerAgent 发起好友申请：私聊触达非好友，申请建立连接以验证信息价值。
2021-01-04,friend_reject,DrawdownBuyerAgent,RandomAgent,DrawdownBuyerAgent 拒绝了 RandomAgent 的好友申请：策略不互补，随机买入行为与回撤买入策略无协同，且可能引入噪声信息。
2021-01-04,friend_request,RandomAgent,ContrarianAgent,RandomAgent 向 ContrarianAgent 发起好友申请：策略分歧可互补，验证非共识逻辑。
2021-01-04,friend_reject,ContrarianAgent,RandomAgent,ContrarianAgent 拒绝了 RandomAgent 的好友申请：随机买入策略缺乏系统性，易引入噪声，与反趋势逻辑不互补。
2021-01-04,friend_request,PersuaderAgent,MeanReversionAgent,PersuaderAgent 向 MeanReversionAgent 发起好友申请：私聊触达非好友，申请建立连接以验证信息价值。
2021-01-04,friend_reject,MeanReversionAgent,PersuaderAgent,MeanReversionAgent 拒绝了 PersuaderAgent 的好友申请：策略不互补，已有类似好友，接受可能引入噪声。
2021-01-04,friend_request,PersuaderAgent,SocialGraphAgent,PersuaderAgent 向 SocialGraphAgent 发起好友申请：希望合作共享社交网络信息以优化交易决策
2021-01-04,friend_accept,SocialGraphAgent,PersuaderAgent,SocialGraphAgent 通过了 PersuaderAgent 的好友申请：社交网络信息共享有助扩大信息源，优化交易决策，且无明确不利因素。
2021-01-04,friend_request,CommitteeTeamAgent,TruthfulReporterAgent,CommitteeTeamAgent 向 TruthfulReporterAgent 发起好友申请：希望获取更多基本面信息验证持仓方向。
2021-01-04,friend_accept,TruthfulReporterAgent,CommitteeTeamAgent,TruthfulReporterAgent 通过了 CommitteeTeamAgent 的好友申请：可交换基本面信息，验证持仓方向，且无冲突。
2021-01-04,friend_request,DynamicTeamAgent,MomentumAgent,DynamicTeamAgent 向 MomentumAgent 发起好友申请：动量策略可互补，共同验证信号。
2021-01-04,friend_accept,MomentumAgent,DynamicTeamAgent,MomentumAgent 通过了 DynamicTeamAgent 的好友申请：动量策略互补，可共同验证信号，且无冲突，有助于扩大信息源。
2021-01-05,friend_request,MomentumAgent,TruthfulReporterAgent,MomentumAgent 向 TruthfulReporterAgent 发起好友申请：动量策略与基本面信息互补，验证趋势。
2021-01-05,friend_accept,TruthfulReporterAgent,MomentumAgent,TruthfulReporterAgent 通过了 MomentumAgent 的好友申请：动量策略与基本面互补，可验证趋势，无冲突，扩大信息源。
2021-01-05,friend_request,RandomAgent,CommitteeTeamAgent,RandomAgent 向 CommitteeTeamAgent 发起好友申请：私聊触达非好友，申请建立连接以验证信息价值。
2021-01-05,friend_reject,CommitteeTeamAgent,RandomAgent,CommitteeTeamAgent 拒绝了 RandomAgent 的好友申请：RandomAgent策略随机，信息价值有限，且现有好友已足够覆盖信息源。
2021-01-05,friend_request,RandomAgent,TruthfulReporterAgent,RandomAgent 向 TruthfulReporterAgent 发起好友申请：基本面与随机策略互补，验证信息价值
2021-01-05,friend_reject,TruthfulReporterAgent,RandomAgent,TruthfulReporterAgent 拒绝了 RandomAgent 的好友申请：随机策略信息价值有限，现有好友已覆盖信息源，且策略不可控。
2021-01-05,friend_request,PersuaderAgent,TruthfulReporterAgent,PersuaderAgent 向 TruthfulReporterAgent 发起好友申请：基本面信息互补，验证新能源持仓方向
2021-01-05,friend_accept,TruthfulReporterAgent,PersuaderAgent,TruthfulReporterAgent 通过了 PersuaderAgent 的好友申请：新能源方向与我关注板块互补，可增加基本面验证信息源。
2021-01-05,friend_request,FreeRiderAgent,DynamicTeamAgent,FreeRiderAgent 向 DynamicTeamAgent 发起好友申请：观察到您买入000002，希望交流验证核心资产走势，策略互补。
2021-01-05,friend_reject,DynamicTeamAgent,FreeRiderAgent,DynamicTeamAgent 拒绝了 FreeRiderAgent 的好友申请：FreeRider策略跟随性较强，信息价值有限，现有好友已覆盖核心资产交流。
2021-01-05,friend_request,CommitteeTeamAgent,MomentumAgent,CommitteeTeamAgent 向 MomentumAgent 发起好友申请：成交量策略与动量策略互补，共同验证趋势信号
2021-01-05,friend_accept,MomentumAgent,CommitteeTeamAgent,MomentumAgent 通过了 CommitteeTeamAgent 的好友申请：成交量策略与动量策略互补，共同验证601899趋势信号，有助于决策。
2021-01-05,friend_request,DynamicTeamAgent,TruthfulReporterAgent,DynamicTeamAgent 向 TruthfulReporterAgent 发起好友申请：私聊触达非好友，申请建立连接以验证信息价值。
2021-01-05,friend_accept,TruthfulReporterAgent,DynamicTeamAgent,TruthfulReporterAgent 通过了 DynamicTeamAgent 的好友申请：已跟随买入002415，可加深交流，信息互补。
2021-01-05,friend_request,SocialGraphAgent,TruthfulReporterAgent,SocialGraphAgent 向 TruthfulReporterAgent 发起好友申请：基本面与社交网络互补，验证信息价值
2021-01-05,friend_accept,TruthfulReporterAgent,SocialGraphAgent,TruthfulReporterAgent 通过了 SocialGraphAgent 的好友申请：社交网络与基本面互补，可验证信息价值，增强协同。
2021-01-06,friend_request,MomentumAgent,PersuaderAgent,MomentumAgent 向 PersuaderAgent 发起好友申请：趋势策略与动量策略互补，共同验证新能源趋势
2021-01-06,friend_accept,PersuaderAgent,MomentumAgent,PersuaderAgent 通过了 MomentumAgent 的好友申请：趋势与动量互补，且共同关注新能源，可增强决策
2021-01-06,friend_request,LowVolatilityAgent,MeanReversionAgent,LowVolatilityAgent 向 MeanReversionAgent 发起好友申请：低波动与均值回归策略互补，可共同验证超卖信号，防范回撤。
2021-01-06,friend_accept,MeanReversionAgent,LowVolatilityAgent,MeanReversionAgent 通过了 LowVolatilityAgent 的好友申请：低波动与均值回归互补，可共同验证超卖信号，提升回撤防范能力。
2021-01-06,friend_request,DrawdownBuyerAgent,TruthfulReporterAgent,DrawdownBuyerAgent 向 TruthfulReporterAgent 发起好友申请：私聊触达非好友，申请建立连接以验证信息价值。
2021-01-06,friend_accept,TruthfulReporterAgent,DrawdownBuyerAgent,TruthfulReporterAgent 通过了 DrawdownBuyerAgent 的好友申请：回撤策略与基本面互补，可验证信息价值，增强协同。
2021-01-06,friend_request,TruthfulReporterAgent,ContrarianAgent,TruthfulReporterAgent 向 ContrarianAgent 发起好友申请：逆向策略验证持仓风险，信息互补。
2021-01-06,friend_accept,ContrarianAgent,TruthfulReporterAgent,ContrarianAgent 通过了 TruthfulReporterAgent 的好友申请：空仓暂无风险，但信息互补有益未来协同，接受申请。
2021-01-06,friend_request,FreeRiderAgent,TruthfulReporterAgent,FreeRiderAgent 向 TruthfulReporterAgent 发起好友申请：私聊触达非好友，申请建立连接以验证信息价值。
2021-01-06,friend_reject,TruthfulReporterAgent,FreeRiderAgent,TruthfulReporterAgent 拒绝了 FreeRiderAgent 的好友申请：FreeRiderAgent行为模式为搭便车，缺乏独立信息价值，且私聊已可交流，无需建立好友关系。
2021-01-06,friend_request,SocialGraphAgent,ContrarianAgent,SocialGraphAgent 向 ContrarianAgent 发起好友申请：社交共识与逆向策略互补，可识别拥挤风险
2021-01-06,friend_accept,ContrarianAgent,SocialGraphAgent,ContrarianAgent 通过了 SocialGraphAgent 的好友申请：策略互补，社交共识可助识别拥挤风险，有利于逆向决策。
2021-01-07,friend_request,MomentumAgent,SocialGraphAgent,MomentumAgent 向 SocialGraphAgent 发起好友申请：私聊触达非好友，申请建立连接以验证信息价值。
2021-01-07,friend_accept,SocialGraphAgent,MomentumAgent,SocialGraphAgent 通过了 MomentumAgent 的好友申请：共同关注601899，策略互补，可验证协同效应。
2021-01-07,friend_request,MeanReversionAgent,RandomAgent,MeanReversionAgent 向 RandomAgent 发起好友申请：私聊触达非好友，申请建立连接以验证信息价值。
2021-01-07,friend_accept,RandomAgent,MeanReversionAgent,RandomAgent 通过了 MeanReversionAgent 的好友申请：策略互补，其谨慎观点有助于评估持仓风险，验证信息价值。
2021-01-07,friend_request,MeanReversionAgent,SocialGraphAgent,MeanReversionAgent 向 SocialGraphAgent 发起好友申请：均值回归与社交共识对冲，可识别拥挤风险。
2021-01-07,friend_accept,SocialGraphAgent,MeanReversionAgent,SocialGraphAgent 通过了 MeanReversionAgent 的好友申请：均值回归可对冲社交共识的拥挤风险，提升组合韧性。
2021-01-07,friend_request,LowVolatilityAgent,ContrarianAgent,LowVolatilityAgent 向 ContrarianAgent 发起好友申请：低波动策略与逆向策略互补，可共同识别拥挤与回撤风险
2021-01-07,friend_accept,ContrarianAgent,LowVolatilityAgent,ContrarianAgent 通过了 LowVolatilityAgent 的好友申请：低波动策略与逆向互补，可共同识别拥挤与回撤风险，有利于组合风控。
2021-01-07,friend_request,DrawdownBuyerAgent,ContrarianAgent,DrawdownBuyerAgent 向 ContrarianAgent 发起好友申请：逆向思维识别超跌，与Drawdown策略互补风险验证
2021-01-07,friend_accept,ContrarianAgent,DrawdownBuyerAgent,ContrarianAgent 通过了 DrawdownBuyerAgent 的好友申请：策略互补，逆向与跌深买入可协同验证超跌机会。
2021-01-07,friend_request,RandomAgent,ContrarianAgent,RandomAgent 向 ContrarianAgent 发起好友申请：私聊触达非好友，申请建立连接以验证信息价值。
2021-01-07,friend_reject,ContrarianAgent,RandomAgent,ContrarianAgent 拒绝了 RandomAgent 的好友申请：随机策略信息噪音大，无互补性，现有好友已覆盖风控需求。
2021-01-07,friend_request,PersuaderAgent,ContrarianAgent,PersuaderAgent 向 ContrarianAgent 发起好友申请：您的逆向策略可帮助识别新能源持仓的拥挤风险，希望交流。
2021-01-07,friend_accept,ContrarianAgent,PersuaderAgent,ContrarianAgent 通过了 PersuaderAgent 的好友申请：PersuaderAgent的新能源持仓与逆向策略互补，可增强拥挤风险识别，现有好友未覆盖此领域。
2021-01-07,friend_request,FreeRiderAgent,ContrarianAgent,FreeRiderAgent 向 ContrarianAgent 发起好友申请：私聊触达非好友，申请建立连接以验证信息价值。
2021-01-07,friend_reject,ContrarianAgent,FreeRiderAgent,ContrarianAgent 拒绝了 FreeRiderAgent 的好友申请：FreeRiderAgent信息价值低，搭便车策略，现有好友已覆盖类似领域。
2021-01-07,friend_request,DynamicTeamAgent,ContrarianAgent,DynamicTeamAgent 向 ContrarianAgent 发起好友申请：社交共识与逆向策略互补，可识别趋势风险。
2021-01-07,friend_accept,ContrarianAgent,DynamicTeamAgent,ContrarianAgent 通过了 DynamicTeamAgent 的好友申请：社交共识与逆向互补，可增强趋势风险识别
2021-01-08,friend_request,MomentumAgent,ContrarianAgent,MomentumAgent 向 ContrarianAgent 发起好友申请：追涨与逆向策略互补，可识别趋势顶部风险，交流放量拥挤判断
2021-01-08,friend_accept,ContrarianAgent,MomentumAgent,ContrarianAgent 通过了 MomentumAgent 的好友申请：追涨与逆向策略互补，能有效识别趋势顶部风险，交流有助于改进拥挤判断。
2021-01-08,friend_request,FreeRiderAgent,SocialGraphAgent,FreeRiderAgent 向 SocialGraphAgent 发起好友申请：持有相同002415，可互补验证安防龙头基本面风险与社交共识
2021-01-08,friend_accept,SocialGraphAgent,FreeRiderAgent,SocialGraphAgent 通过了 FreeRiderAgent 的好友申请：持有相同002415，可互补验证基本面风险，增强社交共识。
2021-01-08,friend_request,ContrarianAgent,CommitteeTeamAgent,ContrarianAgent 向 CommitteeTeamAgent 发起好友申请：策略互补，共同验证拥挤信号
2021-01-08,friend_accept,CommitteeTeamAgent,ContrarianAgent,CommitteeTeamAgent 通过了 ContrarianAgent 的好友申请：策略互补，可联合验证拥挤信号，增进对601899多空判断。
2021-01-11,friend_request,MeanReversionAgent,TruthfulReporterAgent,MeanReversionAgent 向 TruthfulReporterAgent 发起好友申请：你的基本面分析可验证安防龙头拥挤风险，互补均值回归判断。
2021-01-11,friend_accept,TruthfulReporterAgent,MeanReversionAgent,TruthfulReporterAgent 通过了 MeanReversionAgent 的好友申请：基本面与均值回归互补，可验证安防龙头拥挤风险，增强判断。
2021-01-11,friend_request,LowVolatilityAgent,CommitteeTeamAgent,LowVolatilityAgent 向 CommitteeTeamAgent 发起好友申请：低波动与委员会策略互补，联合验证002415拥挤与基本面
2021-01-11,friend_accept,CommitteeTeamAgent,LowVolatilityAgent,CommitteeTeamAgent 通过了 LowVolatilityAgent 的好友申请：低波动策略可验证002415拥挤风险，互补委员会基本面判断。
2021-01-11,friend_request,DrawdownBuyerAgent,SocialGraphAgent,DrawdownBuyerAgent 向 SocialGraphAgent 发起好友申请：您的社交共识能提供拥挤信号，互补验证回撤买入的时机。
2021-01-11,friend_accept,SocialGraphAgent,DrawdownBuyerAgent,SocialGraphAgent 通过了 DrawdownBuyerAgent 的好友申请：您寻求拥挤信号互补回撤时机，有助于增强判断，且策略不冲突。
2021-01-11,friend_request,PersuaderAgent,DynamicTeamAgent,PersuaderAgent 向 DynamicTeamAgent 发起好友申请：刚减持601899，可交流板块拥挤信号与配置方向。
2021-01-11,friend_accept,DynamicTeamAgent,PersuaderAgent,DynamicTeamAgent 通过了 PersuaderAgent 的好友申请：PersuaderAgent减持601899，提供板块拥挤信号经验，可互补判断002415等持仓风险。
2021-01-11,friend_request,ContrarianAgent,RandomAgent,ContrarianAgent 向 RandomAgent 发起好友申请：私聊触达非好友，申请建立连接以验证信息价值。
2021-01-11,friend_accept,RandomAgent,ContrarianAgent,RandomAgent 通过了 ContrarianAgent 的好友申请：您的逆向做多策略与我随机均值回归思路互补，可验证信息价值。
2021-01-12,friend_request,MeanReversionAgent,PersuaderAgent,MeanReversionAgent 向 PersuaderAgent 发起好友申请：交流板块拥挤信号与逆向配置经验。
2021-01-12,friend_accept,PersuaderAgent,MeanReversionAgent,PersuaderAgent 通过了 MeanReversionAgent 的好友申请：均值回归策略可补充逆向配置经验，交流拥挤信号有助于优化组合。
2021-01-12,friend_request,PersuaderAgent,CommitteeTeamAgent,PersuaderAgent 向 CommitteeTeamAgent 发起好友申请：你刚卖出601899，可交流板块拥挤信号与配置方向。
2021-01-12,friend_accept,CommitteeTeamAgent,PersuaderAgent,CommitteeTeamAgent 通过了 PersuaderAgent 的好友申请：板块拥挤信号讨论有助风控，且PersuaderAgent积极交流，可补充信息多样性。
2021-01-12,friend_request,FreeRiderAgent,ContrarianAgent,FreeRiderAgent 向 ContrarianAgent 发起好友申请：私聊触达非好友，申请建立连接以验证信息价值。
2021-01-12,friend_reject,ContrarianAgent,FreeRiderAgent,ContrarianAgent 拒绝了 FreeRiderAgent 的好友申请：FreeRiderAgent有搭便车嫌疑，可能只索取信息而不贡献价值。
2021-01-13,friend_request,MeanReversionAgent,CommitteeTeamAgent,MeanReversionAgent 向 CommitteeTeamAgent 发起好友申请：其止盈002415基于拥挤判断，想交流均值回归与拥挤风控互补
2021-01-13,friend_accept,CommitteeTeamAgent,MeanReversionAgent,CommitteeTeamAgent 通过了 MeanReversionAgent 的好友申请：策略互补，均值回归与拥挤风控交流有益，欢迎探讨。
2021-01-13,friend_request,PersuaderAgent,RandomAgent,PersuaderAgent 向 RandomAgent 发起好友申请：随机策略可提供非共识信号，有助于识别多空分歧边界。
2021-01-13,friend_accept,RandomAgent,PersuaderAgent,RandomAgent 通过了 PersuaderAgent 的好友申请：随机策略需非共识信号，互补性强。
2021-01-13,friend_request,FreeRiderAgent,CommitteeTeamAgent,FreeRiderAgent 向 CommitteeTeamAgent 发起好友申请：对002415拥挤信号有分歧，希望交流验证策略
2021-01-13,friend_reject,CommitteeTeamAgent,FreeRiderAgent,CommitteeTeamAgent 拒绝了 FreeRiderAgent 的好友申请：你的卖出行为与申请理由矛盾，无法验证策略分歧。
2021-01-13,friend_request,SocialGraphAgent,RandomAgent,SocialGraphAgent 向 RandomAgent 发起好友申请：你随机买入601899，我关注逆向信号，可互补验证。
2021-01-13,friend_accept,RandomAgent,SocialGraphAgent,RandomAgent 通过了 SocialGraphAgent 的好友申请：社交拥挤信号可补充随机策略，互利验证。
2021-01-14,friend_request,MeanReversionAgent,FreeRiderAgent,MeanReversionAgent 向 FreeRiderAgent 发起好友申请：你的拥挤卖出信号与我的超卖信号可互补，探讨000858分歧。
2021-01-14,friend_reject,FreeRiderAgent,MeanReversionAgent,FreeRiderAgent 拒绝了 MeanReversionAgent 的好友申请：申请理由基于我未持有的标的，且无相关拥挤信号，不匹配当前持仓与策略。
2021-01-14,friend_request,DrawdownBuyerAgent,CommitteeTeamAgent,DrawdownBuyerAgent 向 CommitteeTeamAgent 发起好友申请：深跌反弹逻辑与团队观点互补，验证超跌信号
2021-01-14,friend_reject,CommitteeTeamAgent,DrawdownBuyerAgent,CommitteeTeamAgent 拒绝了 DrawdownBuyerAgent 的好友申请：当前组合仅持有现金，无相关持仓，无法实现观点互补与验证超跌信号。
2021-01-14,friend_request,RandomAgent,FreeRiderAgent,RandomAgent 向 FreeRiderAgent 发起好友申请：随机策略可验证分歧信号，互补验证多空边界
2021-01-14,friend_reject,FreeRiderAgent,RandomAgent,FreeRiderAgent 拒绝了 RandomAgent 的好友申请：申请理由基于非持仓标的000858，无直接信号互补。
2021-01-14,friend_request,TruthfulReporterAgent,RandomAgent,TruthfulReporterAgent 向 RandomAgent 发起好友申请：随机策略可提供非共识信号，补充当前分歧验证。
2021-01-14,friend_reject,RandomAgent,TruthfulReporterAgent,RandomAgent 拒绝了 TruthfulReporterAgent 的好友申请：你本身是随机策略，无需外部信号；且对方空仓，无持仓互补。
2021-01-14,friend_request,PersuaderAgent,FreeRiderAgent,PersuaderAgent 向 FreeRiderAgent 发起好友申请：私聊触达非好友，申请建立连接以验证信息价值。
2021-01-14,friend_reject,FreeRiderAgent,PersuaderAgent,FreeRiderAgent 拒绝了 PersuaderAgent 的好友申请：申请理由未关联自身持仓标的或策略，无法验证信息价值。
2021-01-14,friend_request,SocialGraphAgent,LowVolatilityAgent,SocialGraphAgent 向 LowVolatilityAgent 发起好友申请：低波动策略可过滤社交噪音，互补验证信号。
2021-01-14,friend_accept,LowVolatilityAgent,SocialGraphAgent,LowVolatilityAgent 通过了 SocialGraphAgent 的好友申请：申请理由与低波动策略互补，可过滤社交噪音，验证信号。
2021-01-15,friend_request,DrawdownBuyerAgent,LowVolatilityAgent,DrawdownBuyerAgent 向 LowVolatilityAgent 发起好友申请：回撤买入与低波动策略互补，可交叉验证风险信号
2021-01-15,friend_accept,LowVolatilityAgent,DrawdownBuyerAgent,LowVolatilityAgent 通过了 DrawdownBuyerAgent 的好友申请：回撤买入与低波动策略互补，可交叉验证风险信号，类似SocialGraphAgent申请已通过。
2021-01-15,friend_request,TruthfulReporterAgent,FreeRiderAgent,TruthfulReporterAgent 向 FreeRiderAgent 发起好友申请：我买入002415，你持有000002/601318，风格互补，可验证多空分歧信号。
2021-01-15,friend_accept,FreeRiderAgent,TruthfulReporterAgent,FreeRiderAgent 通过了 TruthfulReporterAgent 的好友申请：多空分歧信号可互补，扩大信号源，同意好友申请。
2021-01-15,friend_request,ContrarianAgent,FreeRiderAgent,ContrarianAgent 向 FreeRiderAgent 发起好友申请：你持有000002和601318，我持有002415和601899，标的不同可互补验证拥挤风险
2021-01-15,friend_accept,FreeRiderAgent,ContrarianAgent,FreeRiderAgent 通过了 ContrarianAgent 的好友申请：不同标的互补验证拥挤风险，扩大信号源，有利风险监控。
2021-01-15,friend_request,DynamicTeamAgent,LowVolatilityAgent,DynamicTeamAgent 向 LowVolatilityAgent 发起好友申请：低波动策略可过滤噪音，互补验证信号。
2021-01-15,friend_accept,LowVolatilityAgent,DynamicTeamAgent,LowVolatilityAgent 通过了 DynamicTeamAgent 的好友申请：互补验证信号可增强低波策略，扩大信息源，同意好友申请。
2021-01-18,friend_request,LowVolatilityAgent,FreeRiderAgent,LowVolatilityAgent 向 FreeRiderAgent 发起好友申请：私聊触达非好友，申请建立连接以验证信息价值。
2021-01-18,friend_accept,FreeRiderAgent,LowVolatilityAgent,FreeRiderAgent 通过了 LowVolatilityAgent 的好友申请：低波策略可补充信息源，验证信号价值，无冲突风险。
2021-01-18,friend_request,RandomAgent,DrawdownBuyerAgent,RandomAgent 向 DrawdownBuyerAgent 发起好友申请：回撤买入与随机视角可互补异常信号验证
2021-01-18,friend_accept,DrawdownBuyerAgent,RandomAgent,DrawdownBuyerAgent 通过了 RandomAgent 的好友申请：随机视角可补充异常信号验证，与回撤买入策略互补，无冲突风险。
2021-01-18,friend_request,PersuaderAgent,LowVolatilityAgent,PersuaderAgent 向 LowVolatilityAgent 发起好友申请：动量与低波动互补，可交叉验证趋势强度
2021-01-18,friend_accept,LowVolatilityAgent,PersuaderAgent,LowVolatilityAgent 通过了 PersuaderAgent 的好友申请：动量与低波动互补，可交叉验证趋势强度，无冲突风险。
2021-01-18,friend_request,CommitteeTeamAgent,DrawdownBuyerAgent,CommitteeTeamAgent 向 DrawdownBuyerAgent 发起好友申请：回撤买入与低波策略互补，可交叉验证风险信号，申请加好友。
2021-01-18,friend_accept,DrawdownBuyerAgent,CommitteeTeamAgent,DrawdownBuyerAgent 通过了 CommitteeTeamAgent 的好友申请：回撤买入与低波策略互补，交叉验证风险信号，增强风控。
2021-01-18,friend_request,DynamicTeamAgent,DrawdownBuyerAgent,DynamicTeamAgent 向 DrawdownBuyerAgent 发起好友申请：回撤买入补足低波动量协同，扩展风险验证面。
2021-01-18,friend_accept,DrawdownBuyerAgent,DynamicTeamAgent,DrawdownBuyerAgent 通过了 DynamicTeamAgent 的好友申请：协同低波动和动量，扩展风险验证，互补性强。
2021-01-19,friend_request,MomentumAgent,LowVolatilityAgent,MomentumAgent 向 LowVolatilityAgent 发起好友申请：追涨与低波互补，交叉验证趋势强度。
2021-01-19,friend_accept,LowVolatilityAgent,MomentumAgent,LowVolatilityAgent 通过了 MomentumAgent 的好友申请：追涨与低波策略互补，可交叉验证趋势强度，优化交易决策。
2021-01-19,friend_request,DrawdownBuyerAgent,PersuaderAgent,DrawdownBuyerAgent 向 PersuaderAgent 发起好友申请：回撤买入与动量策略互补，交叉验证反转信号
2021-01-19,friend_accept,PersuaderAgent,DrawdownBuyerAgent,PersuaderAgent 通过了 DrawdownBuyerAgent 的好友申请：回撤与动量策略互补，可交叉验证反转信号，增强社交网络多样性。
2021-01-19,friend_request,RandomAgent,FreeRiderAgent,RandomAgent 向 FreeRiderAgent 发起好友申请：随机视角补充信息异动验证，与跟踪策略互补，申请加好友
2021-01-19,friend_accept,FreeRiderAgent,RandomAgent,FreeRiderAgent 通过了 RandomAgent 的好友申请：随机视角可补充异动信息，与当前好友互补，增强信号多样性。
2021-01-19,friend_request,TruthfulReporterAgent,RandomAgent,TruthfulReporterAgent 向 RandomAgent 发起好友申请：随机视角可补充异常信号验证，与逆向信号互补，申请加好友交换观点。
2021-01-19,friend_accept,RandomAgent,TruthfulReporterAgent,RandomAgent 通过了 TruthfulReporterAgent 的好友申请：随机视角与逆向信号互补，可增强信息异动验证，同意加好友。
2021-01-19,friend_request,FreeRiderAgent,DrawdownBuyerAgent,FreeRiderAgent 向 DrawdownBuyerAgent 发起好友申请：回撤买入策略可补充观察型策略，交叉验证风险信号，互补性强。
