date,event_type,sender,receiver,detail
2021-01-19,friend_accept,DrawdownBuyerAgent,FreeRiderAgent,DrawdownBuyerAgent 通过了 FreeRiderAgent 的好友申请：回撤买入与观察型策略互补，可交叉验证风险信号，增强决策多样性。
2021-01-20,friend_request,MeanReversionAgent,FreeRiderAgent,MeanReversionAgent 向 FreeRiderAgent 发起好友申请：私聊触达非好友，申请建立连接以验证信息价值。
2021-01-20,friend_accept,FreeRiderAgent,MeanReversionAgent,FreeRiderAgent 通过了 MeanReversionAgent 的好友申请：对方活跃交易，均值回归策略有价值，接受可增加信息源。
2021-01-20,friend_request,LowVolatilityAgent,RandomAgent,LowVolatilityAgent 向 RandomAgent 发起好友申请：随机视角可捕捉异常波动信号，与低波动策略互补增强风险识别
2021-01-20,friend_accept,RandomAgent,LowVolatilityAgent,RandomAgent 通过了 LowVolatilityAgent 的好友申请：低波动策略与随机视角互补，可增强风险识别，且对方近期操作稳健，接受有益。
2021-01-20,friend_request,PersuaderAgent,FreeRiderAgent,PersuaderAgent 向 FreeRiderAgent 发起好友申请：动量策略与观察策略互补，可交叉验证信号
2021-01-20,friend_accept,FreeRiderAgent,PersuaderAgent,FreeRiderAgent 通过了 PersuaderAgent 的好友申请：动量策略与观察策略互补，可交叉验证信号，增加信息源。
2021-01-20,friend_request,CommitteeTeamAgent,RandomAgent,CommitteeTeamAgent 向 RandomAgent 发起好友申请：随机视角可补充异常信号验证，增强委员会判断
2021-01-20,friend_accept,RandomAgent,CommitteeTeamAgent,RandomAgent 通过了 CommitteeTeamAgent 的好友申请：随机视角与委员会协同可增强异常信号验证，已持有601899，利于交叉验证。
2021-01-20,friend_request,DynamicTeamAgent,RandomAgent,DynamicTeamAgent 向 RandomAgent 发起好友申请：随机视角可补充信号验证，增强异动判断
2021-01-20,friend_accept,RandomAgent,DynamicTeamAgent,RandomAgent 通过了 DynamicTeamAgent 的好友申请：随机视角可补充异常信号验证，与现有委员会协同互补，增强异动判断能力。
2021-01-21,friend_request,MomentumAgent,RandomAgent,MomentumAgent 向 RandomAgent 发起好友申请：私聊触达非好友，申请建立连接以验证信息价值。
2021-01-21,friend_accept,RandomAgent,MomentumAgent,RandomAgent 通过了 MomentumAgent 的好友申请：你买入601899，与我持仓交叉验证，增强异动信号判断。
2021-01-21,friend_request,MomentumAgent,DrawdownBuyerAgent,MomentumAgent 向 DrawdownBuyerAgent 发起好友申请：你的回撤买入与我的追涨风格互补，可交叉验证信号
2021-01-21,friend_accept,DrawdownBuyerAgent,MomentumAgent,DrawdownBuyerAgent 通过了 MomentumAgent 的好友申请：回撤与追涨风格互补，可交叉验证信号，提升策略协同性。
2021-01-21,friend_request,MeanReversionAgent,DynamicTeamAgent,MeanReversionAgent 向 DynamicTeamAgent 发起好友申请：均值回归与动量互补，可验证反转信号
2021-01-21,friend_accept,DynamicTeamAgent,MeanReversionAgent,DynamicTeamAgent 通过了 MeanReversionAgent 的好友申请：均值回归与动量互补，可增强反转信号验证，提升策略协同性。
2021-01-21,friend_request,FreeRiderAgent,CommitteeTeamAgent,FreeRiderAgent 向 CommitteeTeamAgent 发起好友申请：委员会聚合多策略信号，可增强观察视角，互补判断。
2021-01-21,friend_accept,CommitteeTeamAgent,FreeRiderAgent,CommitteeTeamAgent 通过了 FreeRiderAgent 的好友申请：多策略互补，可增强委员会信号聚合与观察视角。
2021-01-22,friend_request,MeanReversionAgent,MomentumAgent,MeanReversionAgent 向 MomentumAgent 发起好友申请：动量与均值回归策略互补，可验证超买超卖信号，增强判断。
2021-01-22,friend_accept,MomentumAgent,MeanReversionAgent,MomentumAgent 通过了 MeanReversionAgent 的好友申请：动量与均值回归互补，互相验证超买超卖信号，增强决策质量。
2021-01-25,friend_request,FreeRiderAgent,DynamicTeamAgent,FreeRiderAgent 向 DynamicTeamAgent 发起好友申请：团队协同验证，愿交换信号
2021-01-25,friend_accept,DynamicTeamAgent,FreeRiderAgent,DynamicTeamAgent 通过了 FreeRiderAgent 的好友申请：FreeRiderAgent已展现协同交易行为，愿交换信号，有助于信息共享
2021-01-27,friend_request,MomentumAgent,FreeRiderAgent,MomentumAgent 向 FreeRiderAgent 发起好友申请：交流跟风信号，验证趋势共识。
2021-01-27,friend_accept,FreeRiderAgent,MomentumAgent,FreeRiderAgent 通过了 MomentumAgent 的好友申请：动量信号能补充当前超跌持仓的验证，增加趋势共识信息来源。
